{
  "$schema": "combo-requirements.schema.json",
  "schemaVersion": 1,
  "rulesVersion": "v2.3",
  "rulesRevision": "v2.3-r5",
  "family": "Combo",
  "description": "Canonical machine-readable fulfillment requirements for Core Combos. Runtime evaluates these structures and never infers requirements from printed prose.",
  "cards": {
    "DDB-CMB-CORE-001": {"name":"Aisle-Three Ambush","displayText":"Play a Kata, then make an Attack in a different zone than your previous Attack this turn","requirements":[{"kind":"priorCardMatches","family":"Kata"},{"kind":"differentZoneFromPreviousAttack"},{"kind":"currentCardMatches","family":"Attack"}]},
    "DDB-CMB-CORE-002": {"name":"Appeal Denied","displayText":"Block an Attack, then make a Reversal that Hits","requirements":[{"kind":"blockHistory","window":"sinceLastTurn"},{"kind":"currentCardMatches","family":"Attack","hit":true},{"kind":"reversal"}]},
    "DDB-CMB-CORE-003": {"name":"Bird Law","displayText":"Jump Attack → Kick in a different Zone","requirements":[{"kind":"orderedSequence","steps":[{"family":"Attack","tags":["Jump"]},{"family":"Attack","tags":["Kick"]}]},{"kind":"differentZoneFromPreviousAttack"}]},
    "DDB-CMB-CORE-004": {"name":"Blitzed Expectations","displayText":"Multi-Hit Attack → any Attack","requirements":[{"kind":"orderedSequence","steps":[{"family":"Attack","tags":["Multi-Hit"]},{"family":"Attack"}]}]},
    "DDB-CMB-CORE-005": {"name":"Block, Stock, and Barrel","displayText":"Block an Attack while you have two or more permanent Equipment cards equipped, then make a Weapon Attack","requirements":[{"kind":"blockHistory","window":"sinceLastTurn"},{"kind":"minimumEquipment","amount":2},{"kind":"weaponAttack"}]},
    "DDB-CMB-CORE-006": {"name":"Blunt Force Seminar","displayText":"Blunt Weapon equipped → Mid Attack","requirements":[{"kind":"equippedCardMatches","family":"Weapon","tags":["Blunt"]},{"kind":"currentCardMatches","family":"Attack","zone":"Mid"}]},
    "DDB-CMB-CORE-007": {"name":"Body Shop Special","displayText":"Mid Punch → Mid Kick against the same opponent","requirements":[{"kind":"orderedSequence","steps":[{"family":"Attack","tags":["Punch"],"zone":"Mid"},{"family":"Attack","tags":["Kick"],"zone":"Mid"}]}]},
    "DDB-CMB-CORE-008": {"name":"Breathe In, Violence Out","displayText":"Play a Kata with the Flow tag → Attack","requirements":[{"kind":"orderedSequence","steps":[{"family":"Kata","tags":["Flow"]},{"family":"Attack"}]}]},
    "DDB-CMB-CORE-009": {"name":"Budget, Breathe, Bonk","displayText":"Play a Kata that generates at least 2 Focus, then Hit with an Attack","requirements":[{"kind":"priorCardMatches","family":"Kata","minimumFocusValue":2},{"kind":"currentCardMatches","family":"Attack","hit":true}]},
    "DDB-CMB-CORE-010": {"name":"Catch and Release Program","displayText":"Block an Attack with a Grapple-tag Defense → Attack that fighter on your next turn","requirements":[{"kind":"blockHistory","window":"sinceLastTurn","tag":"Grapple"},{"kind":"currentCardMatches","family":"Attack"}]},
    "DDB-CMB-CORE-011": {"name":"Catch These Hands","displayText":"Block an Attack → Punch that attacker on your next turn","requirements":[{"kind":"blockHistory","window":"sinceLastTurn"},{"kind":"currentCardMatches","family":"Attack","tags":["Punch"]}]},
    "DDB-CMB-CORE-012": {"name":"Clock In, Block Out","displayText":"Gain Speed, then Block before your next turn","requirements":[{"kind":"speedGainHistory","window":"sinceLastTurn"},{"kind":"blockHistory","window":"sinceLastTurn"}]},
    "DDB-CMB-CORE-013": {"name":"Comment Period Closed","displayText":"Make a Mid Attack that Hits after you played a Defense since your last turn","requirements":[{"kind":"playedCardHistory","window":"sinceLastTurn","family":"Defense"},{"kind":"currentCardMatches","family":"Attack","zone":"Mid","hit":true}]},
    "DDB-CMB-CORE-014": {"name":"Curriculum Vitae","displayText":"During one turn, play an Attack, a Kata, and equip a permanent Equipment or use a Consumable","requirements":[{"kind":"playedCardHistory","window":"turn","family":"Attack"},{"kind":"playedCardHistory","window":"turn","family":"Kata"},{"kind":"playedCardHistory","window":"turn","families":["Equipment","Consumable"]}]},
    "DDB-CMB-CORE-015": {"name":"Empty Hands, Full Problems","displayText":"Play a Kata while you have no Weapon equipped → Hand Attack","requirements":[{"kind":"noWeaponEquipped"},{"kind":"orderedSequence","steps":[{"family":"Kata"},{"family":"Attack","tags":["Hand"]}]}]},
    "DDB-CMB-CORE-016": {"name":"Flexible Schedule","displayText":"Flexible Weapon equipped → attack High and Low in either order","requirements":[{"kind":"equippedCardMatches","family":"Weapon","tags":["Flexible"]},{"kind":"zonesPresent","window":"turn","zones":["High","Low"]},{"kind":"currentCardMatches","family":"Attack"}]},
    "DDB-CMB-CORE-017": {"name":"Guarded Optimism","displayText":"A Guard Defense Blocks an Attack","requirements":[{"kind":"defenseBlocksAttack","tag":"Guard"}]},
    "DDB-CMB-CORE-018": {"name":"Hands, Feet, Repeat","displayText":"Hand Attack → Kick → Hand Attack","requirements":[{"kind":"orderedSequence","steps":[{"family":"Attack","tags":["Hand"]},{"family":"Attack","tags":["Kick"]},{"family":"Attack","tags":["Hand"]}]}]},
    "DDB-CMB-CORE-019": {"name":"Head, Shoulders, Knees & Regret","displayText":"Hit High, then Mid, then Low against the same opponent this turn","requirements":[{"kind":"orderedAttackHits","zones":["High","Mid","Low"],"sameOpponent":true,"window":"turn"}]},
    "DDB-CMB-CORE-020": {"name":"High-Low Budget Cut","displayText":"High Attack → Low Attack against the same opponent","requirements":[{"kind":"orderedSequence","steps":[{"family":"Attack","zone":"High"},{"family":"Attack","zone":"Low"}]}]},
    "DDB-CMB-CORE-021": {"name":"I Meant To Do That","displayText":"Your Attack is Blocked → your next Attack this turn targets a different Zone","requirements":[{"kind":"previousAttackBlocked"},{"kind":"differentZoneFromPreviousAttack"},{"kind":"currentCardMatches","family":"Attack"}]},
    "DDB-CMB-CORE-022": {"name":"Improvised Curriculum","displayText":"Improvised Weapon equipped → any Attack","requirements":[{"kind":"equippedCardMatches","family":"Weapon","tags":["Improvised"]},{"kind":"currentCardMatches","family":"Attack"}]},
    "DDB-CMB-CORE-023": {"name":"Inner Peace Was a Mistake","displayText":"Kata → Kata → Attack in the same turn","requirements":[{"kind":"orderedSequence","steps":[{"family":"Kata"},{"family":"Kata"},{"family":"Attack"}]}]},
    "DDB-CMB-CORE-024": {"name":"Kata-lytic Converter","displayText":"Kata → Attack in the same turn","requirements":[{"kind":"orderedSequence","steps":[{"family":"Kata"},{"family":"Attack"}]}]},
    "DDB-CMB-CORE-025": {"name":"Low-Hanging Fruit","displayText":"Low Attack → Low Attack against the same opponent","requirements":[{"kind":"orderedSequence","steps":[{"family":"Attack","zone":"Low"},{"family":"Attack","zone":"Low"}]}]},
    "DDB-CMB-CORE-026": {"name":"Lowered Expectations","displayText":"Low Attack → High Attack against the same opponent","requirements":[{"kind":"orderedSequence","steps":[{"family":"Attack","zone":"Low"},{"family":"Attack","zone":"High"}]}]},
    "DDB-CMB-CORE-027": {"name":"Maximum Overdojo","displayText":"Trigger any other Combo this turn, then complete a different Combo","requirements":[{"kind":"differentComboAfterCombo","minimumPriorCombos":1,"window":"turn"}]},
    "DDB-CMB-CORE-028": {"name":"No, YOU Come Here","displayText":"Block an Attack with a Parry-tag Defense → attack that fighter on your next turn","requirements":[{"kind":"blockHistory","window":"sinceLastTurn","tag":"Parry"},{"kind":"currentCardMatches","family":"Attack"}]},
    "DDB-CMB-CORE-029": {"name":"Not Today, Gravity","displayText":"Block an Attack with a Dodge-tag Defense → Kick that attacker on your next turn","requirements":[{"kind":"blockHistory","window":"sinceLastTurn","tag":"Dodge"},{"kind":"currentCardMatches","family":"Attack","tags":["Kick"]}]},
    "DDB-CMB-CORE-030": {"name":"One-Two-Oh-No","displayText":"Punch → Punch against the same opponent","requirements":[{"kind":"orderedSequence","steps":[{"family":"Attack","tags":["Punch"]},{"family":"Attack","tags":["Punch"]}]}]},
    "DDB-CMB-CORE-031": {"name":"Panic Into Purpose","displayText":"Begin your turn with at least 2 Junk cards in hand → Attack","requirements":[{"kind":"startingHandTagCount","tag":"Junk","amount":2},{"kind":"currentCardMatches","family":"Attack"}]},
    "DDB-CMB-CORE-032": {"name":"Paperwork and Pain","displayText":"Play a Kata with the Economy tag → Attack","requirements":[{"kind":"orderedSequence","steps":[{"family":"Kata","tags":["Economy"]},{"family":"Attack"}]}]},
    "DDB-CMB-CORE-033": {"name":"Personal Space Violation","displayText":"Knee or Elbow Attack → Hand Attack","requirements":[{"kind":"orderedSequence","steps":[{"family":"Attack","tagsAny":["Knee","Elbow"]},{"family":"Attack","tags":["Hand"]}]}]},
    "DDB-CMB-CORE-034": {"name":"Pocket Snack Tactics","displayText":"Use a Consumable → Low Attack","requirements":[{"kind":"orderedSequence","steps":[{"family":"Consumable"},{"family":"Attack","zone":"Low"}]}]},
    "DDB-CMB-CORE-035": {"name":"Pointy End Forward","displayText":"Blade Weapon equipped → High Attack → Mid Attack","requirements":[{"kind":"equippedCardMatches","family":"Weapon","tags":["Blade"]},{"kind":"orderedSequence","steps":[{"family":"Attack","zone":"High"},{"family":"Attack","zone":"Mid"}]}]},
    "DDB-CMB-CORE-036": {"name":"Purchase Order of Pain","displayText":"Buy a Weapon, then Hit with a Weapon Attack before your next Ascend","requirements":[{"kind":"purchaseHistory","window":"sinceLastAscend","tag":"Weapon"},{"kind":"weaponAttack"},{"kind":"currentCardMatches","family":"Attack","hit":true}]},